{
  "schema_version": "1.0.0",
  "asset_id": "ast_d1d2d3d4d5d6",
  "role": "DELIVERY",
  "media_type": "video",
  "path": "delivery/proj-demo-001/reel-1080x1920.mp4",
  "sha256": "8b53639f152c8fc6ef30802fde462ba0be9cf085f7580dc69efd72e002abbb35",
  "bytes": 999,
  "created_at": "2026-09-20T13:00:00Z",
  "lifecycle": "qc_passed",
  "parent_ids": [
    "ast_a1b2c3d4e5f6"
  ],
  "derivation": {
    "tool": "ffmpeg",
    "tool_version": "9.0.1",
    "operation": "reframe_export"
  },
  "ai_involvement": {
    "ai_generated": "none"
  },
  "rights": {
    "rights_status": "OWNED",
    "commercial_use": "allowed",
    "person_consent": "not_needed",
    "provider_data_scope": "local"
  }
}
