{
  "schema_version": "1.0.0",
  "asset_id": "ast_p1p2p3p4p5p6",
  "role": "REFERENCE",
  "reference_kind": "person",
  "media_type": "image",
  "path": "references/person/anna-front.png",
  "sha256": "f64551fcd6f07823cb87971cfb91446425da18286b3ab1ef935e0cbd7a69f68a",
  "bytes": 2048,
  "created_at": "2026-09-20T12:00:00Z",
  "lifecycle": "approved",
  "rights": {
    "rights_status": "USER_PROVIDED",
    "commercial_use": "allowed",
    "person_consent": "documented",
    "provider_data_scope": "cloud_not_approved",
    "purpose_binding": [
      "proj-demo-001"
    ],
    "edit_approval": true
  }
}
