{
  "schema_version": "1.0.0",
  "asset_id": "ast_a1b2c3d4e5f6",
  "role": "SOURCE",
  "media_type": "video",
  "path": "source/2026-09/interview-raw.mp4",
  "sha256": "25a6634263c1b1f6fc4697a04e2b9904ea4b042a89af59dc93ec1f5d44848a26",
  "bytes": 1048576,
  "created_at": "2026-09-20T12:00:00Z",
  "lifecycle": "ingested",
  "rights": {
    "rights_status": "OWNED",
    "commercial_use": "allowed",
    "person_consent": "not_needed",
    "provider_data_scope": "local"
  },
  "technical": {
    "duration_s": 42.5,
    "width": 1920,
    "height": 1080,
    "fps": 30,
    "codec": "h264"
  }
}
